1;"Santori (Sardine): ""Ora legge elettorale proporzionale con le preferenze e il Pd non rinvii la battaglia sui diritti"" ";NONE
2;"Regionali 2020, Imperia: mercoledì 9 settembre le ""6000 Sardine Ponentine"" in treno a sostegno dei giovani. ""Nessuno ha il coraggio di investire davvero su di loro"" ";NONE
3;Palermo, Sardine in piazza per il No al taglio dei parlamentari ;NONE
4;Sanremo: il gruppo 6000 Sardine Ponentine vorrebbe realizzare una scritta gigante per promuovere l'accoglienza ;NONE
5;Elezioni regionali. Mercoledì le '6000 Sardine Ponentine' in treno da Diano Marina a Ventimiglia per “Young Lives Matter” ;NONE
6;"L'arroganza delle Sardine: ""Il Pd ha vinto le regionali ma il merito è nostro"" ";NONE
7;"Omicidio Don Roberto, Mattia Santori: ""Non mi permetterei mai di commentare un accaduto di questo tipo"" ";NONE
8;Santori si toglie dalla naftalina (e aizza la gente contro il centrodestra) ;NONE
9;Referendum, dalle Sardine a Orfini al berlusconiano Malan: il No si ritrova in piazza (con poca gente) ;NONE
10;"La Sardina Mattia Santori: ""Il grande fraintendimento è aver pensato che esistono le Sardine come ente corporativo della buona politica, invece si tratta di sardinitudine"" ";NONE
11;"""I toscani sono intelligenti..."". Sardine velenose sulla Ceccardi ";NONE
12;La replica silenziosa delle Sardine al comizio di Salvini a Valenza: “Era tempo di tornare in piazza” ;NONE
13;"Referendum taglio parlamentari, la Sardina Mattia Santori: ""Puzza di ipocrisia e populismo, voto no perché tagliano le poltrone col culo degli altri"" ";NONE
14;Referendum, fronte del no in piazza a Roma il 12 settembre ‘guidato’ dalle Sardine ;NONE
15;"Regionali, Nichi Vendola torna in piazza e lo fa con le Sardine: ""La Puglia non si Fitta"" ";NONE
16;Seimila sardine attese in Piazza del Popolo a Faenza ;NONE
17;"Il 'treno' delle sardine: ""Dialogo con Sansa per far sentire la voce dei giovani"" ";NONE
18;Sardine, piazza semi-vuota a Roma: la manifestazione per il No al referendum è un flop ;NONE
19;Le Sardine scendono in piazza a Faenza: appuntamento domenica 13 settembre ;NONE
20;"Da Diano a Ventimiglia: ""In treno con le Sardine Ponentine"". ""Vogliamo far sentire la voce dei giovani"" / Foto e video ";NONE
21;il 13 settembre le Sardine in piazza a Faenza ;NONE
22;Il taglio indebolisce gli elettori, non gli eletti. Perché noi Sardine siamo per il No ;NONE
23;"""Nessuno è straniero"", le Sardine Ponentine realizzano una scritta sulla passeggiata del Sud Est a Sanremo ";NONE
24;Sardine, «Mai più fascismo». Il 18 settembre in piazza Unità tutti in silenzio, suonerà solo un violino ;NONE
25;Dopo il referendum, i partigiani tornano a riprendersi le piazze a difesa della Costituzione ;NONE
26;Intervista ad alcuni esponenti del movimento 6000 Sardine ;NONE
27;"È stata oscurata la pagina Facebook delle ""6000 sardine"" ";NONE
28;Bologna 2 agosto, il ritorno delle Sardine: 10 stazioni della memoria ;NONE
29;Bari, le Sardine scendono in piazza: 'In questo territorio non c'è spazio per le destre sovraniste' ;NONE
30;"Le ""6000 sardine"" ora sono un marchio registrato in Ue ";NONE
31;FAENZA: Le sardine tornano in piazza per parlare di elezioni e referendum ;NONE
32;"Il gennaio ""caldo"" delle Sardine che si trasformano in movimento ";NONE
33;Movimento docenti, studenti disabili “dimenticati” ;NONE
34;“6000 piantine” in Piazza Maggiore per finanziare la cultura estiva a Bologna, l'installazione è delle Sardine ;NONE
35;"Razzismo, 6000 Sardine a Roma per dire ""no a violenze e abusi potere"" ";NONE
36;"""Così sono nate le 6000 sardine"": storia di Giulia, l'aretina che ha creato con tre amici il movimento anti Salvini ";NONE
37;"Le Sardine Ponentine cambiano il nome in ""6000 Sardine Ponentine"" ";NONE
38;#Sardineontour a Matera, accolti dal gruppo “6000 Sardine Basilicata” ;NONE
39;"Referendum, Sardine si schierano per il no: ""Non possiamo tacere"" ";NONE
40;'6000 Sardine Grosseto' flash mob ad Orbetello ;NONE
41;Il movimento 6000 Sardine arriva anche a Rieti ;NONE
42;"""Che nome dare all'evento?"". 6000 sardine: ""Le origini"" ";NONE
43;La lettera delle 6000 Sardine a Giuseppe Conte ;NONE
44;Tornano le sardine, venerdì sera scendono in piazza a Fondi ;NONE
45;6000 Sardine E.T.S.: la polemica sulla società dei fondatori delle Sardine ;NONE
46;"Le Sardine dopo la prima frattura: ""Con le foto si può sbagliare ma il mare è di tutti"" ";NONE
47;"Il ""movimento delle sardine"" anche in Spagna: nato il gruppo ""6000 Sardine Madrid"" ";NONE
48;Santori di 6000 Sardine: 'Le pance sono piene di slogan, noi puntiamo ai cervelli' ;NONE
49;L’appello di 6000 Sardine Rimini. Rispettare le norme per riuscire a ripartire ;NONE
50;Ventimiglia, 6000 Sardine Ponentine e Rete Sanremo Solidale invitano associazioni a flash mob contro chiusura di Campo Roja ;NONE
51;Regionali, Jasmine Cristallo (sardine): “Sì alleanza Pd-M5s ;NONE
52;VIDEO | Arriva l'inno delle Sardine: “6000 (siamo una voce)” - DIRE.it ;NONE
53;Anche Asti ha le sue “6000 Sardine”, in piazza il 14 dicembre con un flash mob ;NONE
54;6000 Sardine al mercato regalano mascherine ;NONE
55;Lettera aperta delle 6000 Sardine Cuneo a Marco Rossi ;NONE
56;Le Sardine tornano in piazza a Genova: “Pronti a fare la nostra parte in vista delle regionali” ;NONE
57;Le Sardine tornano a nuotare ;NONE
58;6000 sardine contro Salvini, cos'è il nuovo movimento di Bologna ;NONE
59;Le Sardine arrivano a Stella: “Ascoltare le esigenze dei cittadini e rivolvere le problematiche dei territori” ;NONE
60;6000 Sardine Umbria tenta la mobilitazione a Terni ma fa flop. Puntiamo sulla manifestazione del 23 ;NONE
61;"Mattia Santori, la biografia delle sardine: ""Chi è davvero, sognatore e vulcano d'idee"". Travolto dagli insulti ";NONE
62;"Le ""6000 sardine"" diventano marchio registrato ";NONE
63;Sardine contro Salvini, da Bologna a New York. I 54 gruppi nati in pochi giorni ;NONE
64;«Occhi stanchi, responsabilità enorme, vita vagabonda: un trascinatore», l'identikit del leader delle Sardine Mattia Santori ;NONE
65;Le sardine pubblicano il loro Manifesto e si prendono sempre più piazze ;NONE
66;Lorenzo Donnoli delle 6000 sardine aggredito a Bologna: «Fr**io di merda» ;NONE
67;"""Non siamo nessuno, ma ci diverte lanciare la monetina"". Parla Santori, leader delle Sardine ";NONE
68;Regionali 2020, le Sardine: “La gente si è svegliata: è la nostra vittoria. Ci vediamo a Scampia” ;NONE
69;"Coronavirus, la denuncia delle Sardine: ""Su Telegram si organizzano per andare in piazza il 4 maggio"" ";NONE
70;Covid-19, ‘6000 Sardine italiane:”Io resto a casa e faccio 6000 cose” ;NONE
71;Sabato 30 novembre le 6000 Sardine in piazza Santa Teresa a Cosenza ;NONE
72;“6000 Sardine Marcianise”, nasce gruppo anche in città #MarcianiseNonSiLega ;NONE
73;"A Bologna nasce il manifesto delle sardine: ""Cari populisti, ci avete risvegliato"" ";NONE
74;6000 Sardine in piazza per George Floyd FOTO E VIDEO ;NONE
75;"Sanremo, 6000 Sardine Ponentine organizza ""20 shoes against racism"" a sostegno delle politiche anti-razzismo ";NONE
76;6000 sardine anche a Parma ;NONE
77;Le Sardine tornano in piazza a Genova e lanciano un messaggio alla politica: “Basta divisioni” ;NONE
78;Per le Sardine Aldo Moro è stato ucciso dalla mafia? Il tweet galeotto fa il giro del web ;NONE
79;"Santori: ""Regionali, centrosinistra svilito se parla solo di nomi. Le Sardine con i candidati che fanno buone proposte"" ";NONE
80;Sardine ad Amici, Santori, Cristallo e Donnoli da Maria De Filippi: «Basta paura! Pratichiamo la bellezza» – Il video ;NONE
81;L’annuncio delle Sardine: “Adesso tocca a noi, Salvini ha suonato un campanello di troppo” ;NONE
82;Sardine, fake news anti polizia. Ecco la verità sul video del migrante a terra ;NONE
83;Il 2 giugno prende il via “Sardine in Bicicletta…pedalando con la Costituzione” ;NONE
84;Oscurata la pagina delle 6000sardine: ad ora sconosciuto il motivo ;NONE
85;Le Sardine vivono anche ai tempi di Coronavirus: su piattaforma ”Immagina” 6000 sardine scrivono ”Lettera dell'Europa al mondo” ;NONE
86;"Santori alle Sardine: ""Prendiamoci una pausa. Non diventiamo una massa di frustrati"" ";NONE
87;Sardine pronte per il mare aperto. Manifestazioni compatte in 25 città: in piazza da Berlino a New York ;NONE
88;Elezioni regionali a luglio, le Sardine: “Il voto in autunno sarebbe più sicuro” ;NONE
89;"""Bacioni da Torino"", il flash mob delle Sardine al Parco del Valentino ";NONE
90;"Sardine: ""Maggioritario dannoso, minoranze vanno rispettate"" ";NONE
91;Cinque post per raccontare il movimento delle sardine ;NONE
92;Caro Michele abbiamo bisogno di buoni maestri ;NONE
93;"Oscurata la pagina 6000 sardine. E anche a Latina parte la catena della ""solidarietà"" ";NONE
94;Le Sardine migliori amiche del governo: “Mascherine tricolori: una vergogna!” ;NONE
95;Sardine in piazza a Roma ;NONE
96;Sardine, battaglia per la scissione romana. La base si dissocia: “Rimossi i moderatori, Ogongo uomo solo al comando” ;NONE
97;“La Ciociaria non si Lega”: domenica la manifestazione delle “6000 Sardine” ;NONE
98;Movimento delle sardine, il calendario degli eventi e la mappa delle prossime manifestazioni ;NONE
99;"La Sardina pentita si scaglia contro il leader: ""Tra liti e minacce decide soltanto Santori"" ";NONE
100;Sardine, la mia piazza liberata dall'odio ;NONE
101;IL CASTORO | Intervista ad Andrea Gareffa, esponente delle Sardine ;NONE
102;Bologna, ecco chi c'è dietro il movimento delle sardine - ildigitale.it ;NONE
103;Le sardine ora puntano le periferie. Bonaccini: con loro stessi valori ;NONE
104;La manifestazione delle Sardine a Piazza Santi Apostoli ;NONE
105;La moltiplicazione dei pesci… ;NONE
106;"Mattia Santori con Benetton e Toscani, sospetto sulla foto del disastro: ""imboscata"", com'è andata veramente ";NONE
107;"FOTO | Piazza Maggiore strapiena di 'sardine' anti Salvini: ""Bologna non abbocca"" - DIRE.it ";NONE
108;Chi c’è dietro il movimento delle “Sardine”? ;NONE
109;Chi paga il palco delle Sardine a piazza Santi Apostoli? ;NONE
110;"Le ""Sardine"" sono sbarcate in Veneto | Oggi Treviso | News | Il quotidiano con le notizie di Treviso e Provincia ";NONE
111;Chi sono le Sardine, il movimento dei flash mob contro Salvini ;NONE
112;"""Sardina amplifica sardina"" con la ""Bella ciao"" di Tosca ";NONE
113;"Sardine, lettera a Repubblica dei quattro fondatori: ""Noi e la libertà di non fare un partito"" ";NONE
114;Sardine, manifesto valoriale e pausa di riflessione: “E’ uno spartiacque, non la fine” ;NONE
115;Mattia Santori leader delle Sardine “Matteo Salvini scenderà nei sondaggi grazie alla nostra discesa in campo” ;NONE
116;I 10 momenti più importanti del 2019 ;NONE
117;Sardine a Roma in Piazza Santi Apostoli il 16 febbraio ;NONE
118;Sondaggi Emilia Romagna, Bonaccini in testa ;NONE
119;100 mila Sardine d'Italia si uniscono a Roma: e ora? Reportage da Piazza San Giovanni ;NONE
120;Le sardine verso Roma per nuotare oltre Salvini | il manifesto ;NONE
121;Procura di Mansura smentisce torture: 'Zaky non ha alcuna ferita' ;NONE
122;M5S, manifestazione in piazza a Roma contro vitalizi: «Non ci arrendiamo». E le Sardine sfidano Salvini ;NONE
123;Cittadini e associazioni di Taranto scrivono a Conte (per l'ennesima volta) ;NONE
124;"Morte di Bosso, il cordoglio della città: ""Ciao indimenticabile Ezio"" ";NONE
125;Calcio giovanile, “Balun e Matetti”: ad Alassio è andata in scena la prima fase ;NONE
126;Lettera al presidente del Consiglio, Giuseppe Conte, inviata da 3495 cittadini e 18 associazioni tarantine ;NONE
127;Lettera al premier Conte sottoscritta da 1092 cittadini e 14 associazioni ;NONE
128;Terza pec inviata al presidente del Consiglio, Giuseppe Conte, sottoscritta da 2030 cittadini e 18 associazioni • Tarantini Time ;NONE
129;Taranto. Lettera al premier Conte sottoscritta da 1092 cittadini e 14 associazioni ;NONE
130;"""Genitori Tarantini"", terza pec inviata al presidente del Consiglio, Giuseppe Conte, sottoscritta da 2030 cittadini e 18 associazioni ";NONE
131;[L'analisi] Goccia, goccia, goccia: il M5S è l'ultimo esempio del concetto di stillicidio applicato alla politica ;NONE
132;“Agrigento in inchiostro di china” ;NONE
133;IL CUORE DI FRANCESCO: «PORTERÒ OVUNQUE IL NOME DI BENESTARE» ;NONE
134;A Villa San Giovanni la decima edizione della cerimonia di consegna dei Premi di Studio Caronte&Tourist ;NONE
135;"Messina, la Biancaneve dei Balocchi inaugura la ""Stagione della Luna"" ";NONE
136;Cilento: indagine de Il Sole 24 ore, ecco i comuni più ricchi e i più poveri ;NONE
137;Messina: la “Compagnia dei balocchi” inaugura la “Stagione della luna” ;NONE
138;Premiate 85 aziende leader per il Lambrusco: di Parma Ceci e Ariola ;NONE
139;Sport, eccellente prova dei ragazzi della scuola media G. Verga di Canicattì ai Giochi Sportivi Studenteschi 2011 ;NONE
140;"""Festa Pd con il nostro spumante"". La rivendicazione delle Sardine - AGI ";NONE
141;Sardine, Giulia Trappoloni: «In piazza, ma non per sempre» ;NONE
142;Giulia, l'anti-Salvini che ha organizzato la piazza di Bologna ;NONE
143;Giuseppe Conte parteciperà alla Festa dell’Unità di Modena ;NONE
144;La seduta psicanalitica di Santori: nella sua lettera critica il Pd, ma già rivede se stesso ;NONE
145;Appello video della sardina aretina Giulia Trappoloni ;NONE
146;Il tour delle Sardine sbarca a Grosseto: appuntamento alla Uisp ;NONE
147;Sardine Bologna, chi sono i 4 ragazzi che hanno riempito piazza Maggiore ;NONE
148;"Santori attacca Salvini e Borgonzoni: ""Sardine più forti della Bestia"" ";NONE
149;"Sardine, tuffo al Papeete: ""Chi non vota resta spiaggiato"" ";NONE
150;Treviso, i leader delle Sardine incontrano Toscani e Luciano Benetton ;NONE
151;I protagonisti del giorno. Top e Flop del 15 gennaio 2020 ;NONE
152;Sardine, a marzo in libreria il libro dei fondatori ;NONE
153;Le Sardine sbarcano in Maremma: Santori e Trappoloni a Grosseto ;NONE
154;"Scanzi e Trappoloni, incontro a Bologna. Il giornalista: ""Bello sapere che ci sono ancora giovani con un'idea pura di politica"" ";NONE
155;Festa «privata»per le Sardine, che ora si congedano ;NONE
156;Migranti: le Sardine incontrano Mediterranea ;NONE
157;Le Sardine coltivano orti popolari al Caab di Bologna ;NONE
158;Le sardine approdano a Messina, oggi manifestazione in piazza Unione europea - Gazzetta del Sud ;NONE
159;Sardine: lo chef, la suora e l'insegnante, ecco chi sono gli anti-Salvini ;NONE
160;"Il ritorno delle sardine: ""Noi di nuovo in piazza per battere Salvini e i populisti"" ";NONE
161;Sardine senza capi ma Santori emerge ;NONE
162;Elezioni Emilia-Romagna. Maxi concerto delle Sardine a Bologna, Santori: «Sarà un evento epocale» ;NONE
163;"Le Sardine ripartono dalle donne: al via la campagna ""Dalla stessa parte"" ";NONE
164;Salvini a cena e le 'sardine' in piazza il 30 novembre a Firenze ;NONE
165;"Sardine ""slow"" contro la ""fretta"" della Lega ";NONE
166;"Sardina ospita sardina, l'appello per il 19 gennaio: ""L'Emilia-Romagna vi aspetta"" | VIDEO ";NONE
167;"VIDEO | Le Sardine a Palermo: ""Esportare modello Ballarò... qui Salvini non è entrato"" ";NONE
168;Sardine “bruciate” dai Benetton tentano il rilancio ;NONE
169;Bologna, la cena delle Sardine: “Replicare questa esperienza in altre regioni” ;NONE
170;La crisi delle Sardine. Santori stacca la spina: “Ci prendiamo una pausa” ;NONE
171;Sardine Bologna, festa del centrosinistra alle Cucine Popolari ;NONE
172;I quattro amici (senza tessere) delle «sardine» ;NONE
173;Mattia Santori, chi è il leader delle Sardine ;NONE
174;In arrivo il perdibile libro di Santori e co. “Le sardine non esistono” ;NONE
175;Movimento delle Sardine, chi è Mattia Santori? Biografia, curriculum e notizie sul 32enne ;NONE
176;Sardine, chi sono gli ideatori del movimento simbolo della protesta anti-Salvini ;NONE
177;Sardine in crisi d'identità, “eravamo innovazione, purezza, coinvolgimento” ;NONE
178;Le Sardine si spaccano sulla foto dei fondatori con Benetton? No, iniziativa isolata di Ogongo ;NONE
179;Anche Ravenna adesso ha le sue 'Sardine' – Ravenna24ore ;NONE
180;Chi sono le sardine ;NONE
181;Dal laboratorio Bologna alla prova della politica. Le sardine a congresso ;NONE
182;La leader delle 6mila sardine invocava la morte di Salvini ;NONE
183;Le sardine diventano una corrente del Pd ;NONE
184;Unite, radicali e coraggiose ;NONE
185;Chi c'è dietro le Sardine ;NONE
186;Lettera aperta alle sardine ;NONE
187;"La 'mente' delle sardine Santori: ""Non ho più una vita. Riceviamo 200, 300 richieste al giorno"" - AGI ";NONE
188;«È questa la nostra rivoluzione»: dialogo in esclusiva tra Joshua Wong e le Sardine ;NONE
189;Le Sardine ospiti alla Festa Pd, il leader Santori: «Amiamo la politica» ;NONE
190;Il basso profilo di Santori & Co. «camuffati» tra la gente ;NONE
191;L'exploit delle «sardine»: chi sono e dove vogliono andare gl'ideatori dei flash mob anti-Salvini ;NONE
192;Fenomenologia delle Sardine, il ritorno a Bologna a due mesi dal primo flash mob, Santori: «Comunque vada, abbiamo già vinto» ;NONE
193;Voto in Emilia Romagna, sardine verso il gran finale. «Comunque vada, a marzo faremo il congresso ;NONE
194;Sardine, tuffo fuori stagione per i quattro leader nazionali per invitare a votare ;NONE
195;Il 30 novembre 'Sardine' in piazza anche a Firenze, dopo Bologna ;NONE
196;Il Pd sceglie le Sardine ed esclude Renzi ;NONE
197;"Le Sardine tornano in Piazza Maggiore con 6 mila piantine: ""Se si trasformano in fondi per la cultura abbiamo vinto tutti"" ";NONE
198;Sardine, dopo il 26 gennaio avrà inizio la «Fase 3»: ci sarà il primo vero congresso nazionale ;NONE
199;Quella società di Santori & Co. all'insaputa di tutte le sardine ;NONE
200;"Incontro Sardine - studenti Fermi, Lega ad Azzolina: ""Stigmatizzare formalmente l'assemblea"" ";NONE
201;"Coronavirus, i portavoce nazionali delle Sardine: ""Da Fontana a Zaia, classe politica di mediocrità imbarazzante"" ";NONE
202;"Sardine: ""Siamo state l'ossigeno in Emilia-Romagna, da sole non siamo bastate in Calabria"" ";NONE
203;"Sardine a Bologna, Pizzarotti: ""Ieri quattro semplici ragazzi hanno sconfitto la Bestia di Salvini"" ";NONE
204;"Bologna, la sfida a Salvini: ""In seimila sul Crescentone: più sardine che leghisti"" ";NONE
205;"Le ""Sardine"" fanno tappa in città Pranzo con gli attivisti ";NONE
206;Le sardine presentano il loro manifesto: «Cari populisti, la festa è finita» ;NONE
207;Ad Arquata la tappa marchigiana del tour nazionale delle Sardine ;NONE
208;Sardine: “Cala sipario su una bella favola. Torniamo noi stessi e ci vediamo a Scampia” ;NONE
209;"Il bagno propiziatorio delle Sardine: ""Chi non vota resta spiaggiato"" ";NONE
210;Le sardine anti Salvini a Rimini diventano saraghine: ecco l'orario ufficiale del flash mob ;NONE
211;Sardine, il leader romano Stephen Ogongo rompe con Mattia Santori ;NONE
212;Sei anche tu una sardina? ;NONE
213;Sardine in piazza a Recco: «No alla chiusura dei centri di accoglienza per migranti» ;NONE
214;«Il successo di Bologna? Da troppo tempo non andavamo in strada» ;NONE
215;C'è il coronavirus ma le sardine hanno scritto un libro ;NONE
216;"Santori da Fazio: ""Sardine nemico numero uno del populismo"". Ma il web insorge ";NONE
217;Sardine a Firenze: dove e quando si svolge la manifestazione contro odio e razzismo - Firenze ;NONE
218;Da Amici alle navi dei migranti. Sardine in missione con le Ong ;NONE
219;Le sardine si giocano tutto col voto in Emilia Romagna ;NONE
220;"Prove tecniche di ""sardine"": conta social per inserirsi nel movimento ";NONE
221;Le Sardine ora pensano al Papeete: “Siamo in 40 mila, abbiamo già vinto” ;NONE
222;Dalla piazza al congresso: le sardine vogliono dialogare con la politica ;NONE
223;Conte sulle Sardine: “Mi fanno simpatia, a disposizione per incontro” ;NONE
224;Il programma delle Sardine in una lettera scritta al premier Conte ;NONE
225;E’ il giorno della manifestazione delle Sardine in San Jacopo ;NONE
226;Le Sardine bolognesi come le Madamin torinesi? ;NONE
227;Sardine: sotto l'antisalvinismo, niente ;NONE
228;Quei legami tra le Sardine e Prodi ;NONE
229;Le Sardine di Forlì in piazza il 12 dicembre. Ecco chi sta organizzando la manifestazione ;NONE
230;Travaglio dice che le Sardine di Bologna hanno lo stesso spirito del V-Day di Grillo ;NONE
231;Eccoci: L ;NONE
232;"Urne chiuse, le Sardine fanno calare il sipario. Venneri: ""Futuro da scoprire, non siamo soli"" ";NONE
234;Sardine in giro per l’Italia. Qual è il loro vero messaggio? ;NONE
235;"Mattia Santori: ""Il popolo del Pd è più maturo dei suoi dirigenti"" ";NONE
236;Mattia Santori e l’incapacità, in un mondo che cambia, di cambiare registro ;NONE
237;"Mattia Santori, sardine in piazza a Roma per il ""No"" al referendum: scarso afflusso, il capo è assente ";NONE
238;"Mattia Santori insulta Matteo Salvini: ""Un bollito, Luca Zaia lo batte perché è uno zombie"" ";NONE
239;"Mattia Santori, al comizio di Luigi Di Maio si presenta con la t-shirt: ""Così NO la piazza che non ci sta"" ";NONE
240;"Mattia Santori contro Matteo Salvini: ""Non ci sto a farlo passare per vittima, il suo staff si è sfregato le mani per l'aggressione"" ";NONE
241;Mattia Santori ;NONE
242;"Referendum, Mattia Santori: ""Voto no. Non voto a scatola chiusa, non mi fido"" ";NONE
243;Regionali Toscana: Mattia Santori contestato ;NONE
244;"Mattia Santori, il padre di Susanna Ceccardi interrompe il comizio delle sardine a Cascina: ""I veri fascisti siete voi"" ";NONE
245;"Pd, Santori a Zingaretti: ""Senza progetto condiviso e allargato non si va da nessuna parte"" ";NONE
246;Sardine in piazza, manifestazione flop: il capo è assente ;NONE
247;"Santori: ""Salvini aggredito? Non sono improbabili risposte violente a provocazioni"" ";NONE
248;"La rivendicazione delle Sardine: ""Il Pd festeggia con il nostro spumante"" ";NONE
249;Torniamo al finanziamento pubblico dei partiti, dice Mattia Santori ;NONE
250;"Le Sardine tornano a pungere, Santori: ""Salvini bollito già dal... ";NONE
251;CERVIA: Le Sardine lanciano crowfounding per comprare una nave per salvare i migranti | VIDEO ;NONE
252;"Sallusti e Santori a DiMartedì, la sardina: ""In imbarazzo, sono d'accordo con lui e in disaccordo con Bersani"" ";NONE
253;Sardine in fuga: Mattia, niente idee ma confuse ;NONE
254;Santori: «Non mi fido. Voto No al Referendum» ;NONE
255;Lega, vicesegretario Crippa: 'Da matti mettere in discussione Salvini' ;NONE
256;“Durante il Lockdown abbiamo studiato, per questo diciamo no al taglio dei parlamentari” ;NONE
257;Il ritorno alle preferenze? W l’anticasta che fa i conti con la realtà ;NONE
258;‘Mattia Santori? Vulcano di idee ed emozioni’: post delle sardine con agiografia del leader ;NONE
259;"Mattia Santori: ""Il dialogo col Pd? E' serrato, talvolta duro"" ";NONE
260;Venerdì 25 settembre cerimonia di apertura del Festival Internazionale dell'aquilone a Cervia ;NONE
261;Mattia Santori è chiaro: “Le sardine non saranno mai un partito” ;NONE
262;Chi è Mattia Santori, il volto pubblico del movimento delle Sardine ;NONE
263;"Sardine, Sergio Echamanov lascia il movimento di Mattia Santori: ""Tutti capetti"" ";NONE
264;Che cos’è il movimento delle Sardine e chi è il suo ideatore Mattia Santori ;NONE
265;Chi è Mattia Santori e chi c’è dietro le 6.000 sardine ;NONE
266;"Veronesi a Cascina con Mattia Sartori: ""Questo è il momento delle scelte decise"" ";NONE
267;Mattia Santori scrive alle Sardine: cari amici vi scrivo per dirvi che così non va... e invita a non sprecare tutto ;NONE
268;Elezioni e referendum 2020, vincitori e vinti – Conte si rafforza, Zingaretti può capitalizzare, si… ;NONE
269;"Mattia Santori: ""Di sicuro le Sardine non sono così ingorde di ciliegie come Salvini"" ";NONE
270;"Mattia Santori (Sardine): ""I media sono ossessionati da Salvini"" ";NONE
271;Sardine pronte a lanciare il tour elettorale, Mattia Santori avverte: “Non siamo scomparsi” ;NONE
272;Quella telefonata del Papa a Mattia Santori. Ma era uno scherzo de La Zanzara ;NONE
273;L'ossessione per la leadership ha distrutto le Sardine ;NONE
274;Mattia Santori, un gruppo di ex Sardine fonda un partito ispirato a Massimo Cacciari e Liliana Segre ;NONE
275;"Coronavirus, la Sardina Mattia Santori: ""Confermo il giudizio positivo sul governo Conte perché sono i dati a dirlo"" ";NONE
276;"Mattia Santori, parla un'ex sardina: ""Ci controllavano anche i social, liti e tensioni. Era una guerra civile"" ";NONE
277;"Mattia Santori, le Sardine mollano il capo: ""Non vi bastano le piantine, ora pausa di riflessione"" ";NONE
278;"Mattia Santori, la Sardina più famosa d'Italia: ""Sono favorevole al processo a Salvini, andiamo a scoprire quanto si è spinto oltre i suoi mezzi"" ";NONE
279;"Mattia Santori: ""Il mare non si scinde"" ";NONE
280;The Social Dilemma, brutto ma necessario ;NONE
281;"Mattia Santori massacrato a In Onda: ""Sardine? Sembrate le giovanili del partito di Giuseppe Conte"" ";NONE
282;Domenica tour Sardine nella campagne di Taranto, ci sarà anche Mattia Santori - DIRE.it ;NONE
283;"Mattia Santori: ""La mia vita da sardina"" ";NONE
284;"Nicola Porro contro Mattia Santori: ""Si sente il nuovo Messia a 30 anni, ma ha combinato zero"" ";NONE
285;Sardine: chi è Mattia Santori? Biografia del leader del movimento ;NONE
286;I nuovi intellò della sinistra ;NONE
287;"Regionali, la sardina Mattia Santori: ""Non diamo indicazioni di voto"" ";NONE
288;"Sardine, Mattia Santori: ""Non siamo spariti, ci stiamo riorganizzando per il futuro"" ";NONE
